"US economy shrinks in second quarter, signaling unofficial start of recession",2022-07-28,1,0,0,0,0,0,0,1,1,[4072.42993164],[4130.29003906],[4151.93994141],[57.86010742],[79.51000977],עלייה,עלייה
"Global recession risk rising as economic outlook ‘darkens significantly’, IMF says",2022-07-14,1,0,0,0,0,1,0,1,1,[3790.37988281],[3863.15991211],[3998.94995117],[72.7800293],[208.57006836],עלייה,עלייה
"‘No clarity, no justice’: mother of murdered Mexican photojournalist seeks answers",2022-07-10,1,0,1,0,0,1,0,1,1,,[3854.42993164],,,,ללא שינוי,ללא שינוי
Ukraine calls for international tribunal to bring Putin to justice more quickly,2022-07-21,0,1,1,0,0,0,0,1,1,[3998.94995117],[3961.62988281],[4072.42993164],[-37.32006836],[73.47998047],ירידה,עלייה
"The ‘Thomas court’: after biding his time, rightwing justice finds his power",2022-07-10,1,0,1,0,0,0,0,1,1,,[3854.42993164],,,,ללא שינוי,ללא שינוי
Justice finally arrives for Bernard Collaery but damage already done | Christopher Knaus,2022-07-07,0,0,1,0,0,1,0,1,1,[3902.62011719],[3899.37988281],[3790.37988281],[-3.24023438],[-112.24023438],ירידה,ירידה
TechScape: What should social media giants do to protect children?,2022-07-27,1,0,1,0,0,0,0,1,1,[4023.61010742],[4072.42993164],[4155.16992188],[48.81982422],[131.55981445],עלייה,עלייה
Pulp to reform (again) for 2023 concerts,2022-07-26,0,1,0,1,0,0,0,1,0,[3921.05004883],[4023.61010742],[4091.18994141],[102.56005859],[170.13989258],עלייה,עלייה
Bipartisan Senate group reaches deal to reform Electoral Count Act,2022-07-20,1,1,1,0,0,0,0,1,1,[3959.89990234],[3998.94995117],[4023.61010742],[39.05004883],[63.71020508],עלייה,עלייה
Dismay as UK gambling reform white paper shelved for fourth time,2022-07-14,0,0,1,0,0,1,0,1,1,[3790.37988281],[3863.15991211],[3998.94995117],[72.7800293],[208.57006836],עלייה,עלייה
"Workplace reform to proceed even without consensus at jobs summit, Tony Burke says",2022-07-20,0,1,1,0,0,0,1,1,0,[3959.89990234],[3998.94995117],[4023.61010742],[39.05004883],[63.71020508],עלייה,עלייה
‘Worse than we thought’: Labor says urgent reform needed to fix aged care crisis,2022-07-06,1,0,1,0,0,1,0,1,1,[3845.08007812],[3902.62011719],[3801.7800293],[57.54003906],[-43.30004883],עלייה,ירידה
Kew Gardens secures a multimillion-pound climate change investment ,2022-07-27,0,1,0,0,0,0,1,0,1,[4023.61010742],[4072.42993164],[4155.16992188],[48.81982422],[131.55981445],עלייה,עלייה
Pacific leaders welcome Australia’s ‘renewed commitment’ to climate change,2022-07-14,0,1,1,1,1,0,0,1,1,[3790.37988281],[3863.15991211],[3998.94995117],[72.7800293],[208.57006836],עלייה,עלייה
‘Change is possible’: meet the Gen-Zers who embrace climate optimism ,2022-07-15,0,1,1,1,0,1,0,0,1,[3863.15991211],,[3961.62988281],,[98.4699707],ללא שינוי,עלייה
Grassroots push to include climate change in Labor’s revamp of national conservation laws,2022-07-22,1,0,1,0,0,1,0,1,1,[3961.62988281],,[4130.29003906],,[168.66015625],ללא שינוי,עלייה
Leading environment group says Labor must include ratchet mechanism in climate change bill,2022-07-20,0,1,0,0,0,0,0,1,1,[3959.89990234],[3998.94995117],[4023.61010742],[39.05004883],[63.71020508],עלייה,עלייה
Bangladesh is paying a high price for developed world’s carbon emissions | Letter,2022-07-10,1,0,1,0,0,1,0,0,1,,[3854.42993164],,,,ללא שינוי,ללא שינוי
Australia’s farcical climate policy: market forces to cut emissions and subsidies to destroy carbon sinks | Richard Denniss,2022-07-12,0,0,1,0,0,1,0,1,1,[3818.80004883],[3801.7800293],[3936.68994141],[-17.02001953],[117.88989258],ירידה,עלייה
Ireland targets 25% cut in agriculture emissions but farmers voice anger,2022-07-29,1,0,1,0,0,1,1,1,1,[4130.29003906],,[4145.18994141],,[14.89990234],ללא שינוי,עלייה
Amazon: e-cargo bikes to replace thousands of van deliveries in London,2022-07-03,0,1,0,0,1,0,1,0,0,,,,,,ללא שינוי,ללא שינוי
Energy use from US cryptomining firms is contributing to rising utility bills,2022-07-16,1,0,1,0,0,0,0,1,1,,,,,,ללא שינוי,ללא שינוי
UK cybersecurity chiefs back plan to scan phones for child abuse images,2022-07-21,1,1,1,0,0,0,0,1,0,[3998.94995117],[3961.62988281],[4072.42993164],[-37.32006836],[73.47998047],ירידה,עלייה
‘Some staff work behind armoured glass’: a cybersecurity expert on The Undeclared War,2022-07-07,1,1,0,0,0,0,0,1,1,[3902.62011719],[3899.37988281],[3790.37988281],[-3.24023438],[-112.24023438],ירידה,ירידה
"Apple should scan iPhones for child abuse images, says scanning technology inventor",2022-07-31,1,0,1,0,0,0,0,1,1,,[4118.62988281],,,,ללא שינוי,ללא שינוי
‘Lives are at stake’: hacking of US hospitals highlights deadly risk of ransomware,2022-07-14,1,0,1,0,0,1,0,1,1,[3790.37988281],[3863.15991211],[3998.94995117],[72.7800293],[208.57006836],עלייה,עלייה
TechScape: What should social media giants do to protect children?,2022-07-27,1,0,1,0,0,0,0,1,1,[4023.61010742],[4072.42993164],[4155.16992188],[48.81982422],[131.55981445],עלייה,עלייה
"US economy shrinks in second quarter, signaling unofficial start of recession",2022-07-28,1,0,0,0,0,0,0,1,1,[4072.42993164],[4130.29003906],[4151.93994141],[57.86010742],[79.51000977],עלייה,עלייה
How strong is the US economy? Depends on which party you ask,2022-07-30,1,0,0,0,0,0,0,1,1,,,,,,ללא שינוי,ללא שינוי
Thursday briefing: What the end of the McDonald’s 99p cheeseburger tells us about the economy,2022-07-28,1,0,0,0,0,0,0,1,1,[4072.42993164],[4130.29003906],[4151.93994141],[57.86010742],[79.51000977],עלייה,עלייה
IMF says global economy is edging towards recession,2022-07-26,1,0,0,0,0,1,0,1,1,[3921.05004883],[4023.61010742],[4091.18994141],[102.56005859],[170.13989258],עלייה,עלייה
Apple surpasses expectations as tech companies struggle in slow economy,2022-07-28,0,1,0,0,0,0,0,1,1,[4072.42993164],[4130.29003906],[4151.93994141],[57.86010742],[79.51000977],עלייה,עלייה
Body politics: the secret history of the US anti-abortion movement | Sarah Churchwell,2022-07-23,1,0,1,0,0,1,0,1,1,,,,,,ללא שינוי,ללא שינוי
Party politics won’t solve the climate crisis | Letters,2022-07-24,1,0,1,0,0,1,0,1,1,,[3966.84008789],,,,ללא שינוי,ללא שינוי
Sunak’s interruptions ignite debate over ‘mansplaining’ in politics ,2022-07-26,0,0,1,0,0,0,0,1,0,[3921.05004883],[4023.61010742],[4091.18994141],[102.56005859],[170.13989258],עלייה,עלייה
We ignore moods in politics at our peril | Letters,2022-07-25,1,0,0,0,0,0,0,1,1,[3966.84008789],[3921.05004883],[4118.62988281],[-45.79003906],[151.78979492],ירידה,עלייה
US faces new era of political violence as threats against lawmakers rise,2022-07-31,1,0,1,0,0,0,0,1,1,,[4118.62988281],,,,ללא שינוי,ללא שינוי
High Noon at 70: the politically loaded anti-western adored by US presidents,2022-07-24,1,0,1,0,0,1,0,1,0,,[3966.84008789],,,,ללא שינוי,ללא שינוי
Sri Lanka: president agrees to resign amid unrest,2022-07-09,0,0,1,1,0,1,0,1,1,,,,,,ללא שינוי,ללא שינוי
Sri Lankan president Gotabaya Rajapaksa flees the country,2022-07-12,1,0,1,0,0,1,0,1,1,[3818.80004883],[3801.7800293],[3936.68994141],[-17.02001953],[117.88989258],ירידה,עלייה
Sri Lanka president vote: Ranil Wickremesinghe wins amid protests,2022-07-20,1,0,1,0,0,1,0,1,1,[3959.89990234],[3998.94995117],[4023.61010742],[39.05004883],[63.71020508],עלייה,עלייה
Daughter demands postmortem after death of Angola’s former president,2022-07-08,1,0,1,0,0,0,0,1,1,[3899.37988281],,[3863.15991211],,[-36.2199707],ללא שינוי,ירידה
Italian election 2022:  live official results,2022-09-26,0,0,0,0,0,0,0,1,0,[3655.04003906],[3647.29003906],[3678.42993164],[-7.75],[23.38989258],ירידה,עלייה
Republicans unveil 90s-throwback midterm election agenda,2022-09-23,1,1,1,0,0,0,1,1,1,[3693.22998047],,[3585.62011719],,[-107.60986328],ללא שינוי,ירידה
Bannon is not finished: his ‘precinct strategy’ could alter US elections for years,2022-09-10,1,0,1,0,0,0,0,1,1,,,,,,ללא שינוי,ללא שינוי
Italian rightwing coalition makes final push before election,2022-09-23,0,1,1,0,1,0,0,1,0,[3693.22998047],,[3585.62011719],,[-107.60986328],ללא שינוי,ירידה
Donald Trump says he plans to pardon US Capitol attack participants if elected,2022-09-01,0,0,1,0,0,0,0,1,1,[3966.85009766],[3924.26000977],[4006.17993164],[-42.59008789],[39.32983398],ירידה,עלייה
Kenya’s supreme court upholds William Ruto’s win in presidential election,2022-09-05,0,1,1,1,0,0,0,1,1,,[3908.18994141],[4110.41015625],,,ללא שינוי,ללא שינוי
Italian election 2022:  live official results,2022-09-26,0,0,0,0,0,0,0,1,0,[3655.04003906],[3647.29003906],[3678.42993164],[-7.75],[23.38989258],ירידה,עלייה
Republicans unveil 90s-throwback midterm election agenda,2022-09-23,1,0,1,0,0,0,1,1,1,[3693.22998047],,[3585.62011719],,[-107.60986328],ללא שינוי,ירידה
Italian rightwing coalition makes final push before election,2022-09-23,0,1,1,0,1,0,1,1,1,[3693.22998047],,[3585.62011719],,[-107.60986328],ללא שינוי,ירידה
"‘Olê, olá, Lula!’ Brazil’s voters sing for a heroic comeback to banish Bolsonaro",2022-09-18,1,1,1,1,1,1,0,1,1,,[3899.88989258],,,,ללא שינוי,ללא שינוי
Italian election 2022:  live official results,2022-09-26,0,0,0,0,0,0,0,1,0,[3655.04003906],[3647.29003906],[3678.42993164],[-7.75],[23.38989258],ירידה,עלייה
Italy: Salvini faces calls to quit as League chief after dismal election results,2022-09-27,0,0,1,0,0,1,0,1,0,[3647.29003906],[3719.04003906],[3790.92993164],[71.75],[143.63989258],עלייה,עלייה
Swedish election: far right makes gains but overall result on knife-edge,2022-09-12,1,0,1,0,0,0,0,1,1,[4110.41015625],[3932.68994141],[3899.88989258],[-177.72021484],[-210.52026367],ירידה,ירידה
How Truss beat Sunak: round by round Tory leadership results,2022-09-05,0,0,0,0,0,0,0,1,0,,[3908.18994141],[4110.41015625],,,ללא שינוי,ללא שינוי
Republicans won’t commit to honoring vote results this fall. That’s troubling | Robert Reich,2022-09-22,1,0,1,0,0,1,0,1,1,[3757.98999023],[3693.22998047],[3640.4699707],[-64.76000977],[-117.52001953],ירידה,ירידה
Labour membership rises as party ends conference buoyed by polls,2022-09-28,0,1,1,0,0,0,0,1,1,[3719.04003906],[3640.4699707],[3783.2800293],[-78.57006836],[64.23999023],ירידה,עלייה
"The more Tory voters see of Liz Truss, the less they like her, polls show",2022-09-03,0,0,0,0,0,0,0,1,1,,,,,,ללא שינוי,ללא שינוי
Italy elections: Giorgia Meloni hails ‘night of pride’ as exit polls point to far-right coalition victory,2022-09-26,1,1,0,1,0,1,0,1,1,[3655.04003906],[3647.29003906],[3678.42993164],[-7.75],[23.38989258],ירידה,עלייה
Polling shows that US voters favor climate bills – yet assume fellow Americans don’t | Adrienne Matei,2022-09-01,1,1,0,0,0,0,0,1,1,[3966.85009766],[3924.26000977],[4006.17993164],[-42.59008789],[39.32983398],ירידה,עלייה
Swiss to vote in national poll on banning factory farming,2022-09-23,0,0,0,0,0,0,1,1,1,[3693.22998047],,[3585.62011719],,[-107.60986328],ללא שינוי,ירידה
The Cancer Conflict review – poignant documentary on alternative cancer therapies,2022-09-13,1,0,0,0,0,1,0,1,1,[3932.68994141],[3946.01000977],[3855.92993164],[13.32006836],[-76.76000977],עלייה,ירידה
"‘I will defend the country’: while some Russians flee draft, others head to war",2022-09-29,1,0,1,0,0,1,0,1,1,[3640.4699707],[3585.62011719],[3744.52001953],[-54.84985352],[104.05004883],ירידה,עלייה
How cycling has put us on the road to conflict | Letters,2022-09-02,1,0,1,0,0,0,0,1,0,[3924.26000977],,[4067.36010742],,[143.10009766],ללא שינוי,עלייה
Turtle concern: Australian businessman denies threatening to sell Conflict Islands to China,2022-09-25,1,0,0,0,0,0,0,1,1,,[3655.04003906],,,,ללא שינוי,ללא שינוי
The Inspection review – military drama mixes queerness with convention,2022-09-09,0,1,0,0,0,1,0,1,0,[4067.36010742],,[3873.33007812],,[-194.0300293],ללא שינוי,ירידה
Nasa successfully crashes spacecraft into asteroid in planetary defense test,2022-09-27,0,1,0,1,1,0,0,1,1,[3647.29003906],[3719.04003906],[3790.92993164],[71.75],[143.63989258],עלייה,עלייה
JD Vance playing defense in unexpectedly close Ohio Senate race ,2022-09-25,1,0,0,0,0,0,0,1,1,,[3655.04003906],,,,ללא שינוי,ללא שינוי
Nasa releases images of ‘planetary defense test’ as spacecraft crashed into asteroid,2022-09-29,0,1,0,1,0,0,0,1,1,[3640.4699707],[3585.62011719],[3744.52001953],[-54.84985352],[104.05004883],ירידה,עלייה
Tory backbenchers despair at ‘toxic’ mini-budget,2022-09-23,0,0,1,0,0,1,0,1,1,[3693.22998047],,[3585.62011719],,[-107.60986328],ללא שינוי,ירידה
Was the mini-budget a cunning Tory plan? | Letter,2022-09-27,1,0,0,0,0,0,0,1,1,[3647.29003906],[3719.04003906],[3790.92993164],[71.75],[143.63989258],עלייה,עלייה
The Inspection review – military drama mixes queerness with convention,2022-09-09,1,1,0,0,0,1,0,1,0,[4067.36010742],,[3873.33007812],,[-194.0300293],ללא שינוי,ירידה
"David Squires on … Premier League tributes, queues and military hardware",2022-09-20,0,0,0,0,0,0,0,0,0,[3855.92993164],[3789.92993164],[3647.29003906],[-66.],[-208.63989258],ירידה,ירידה
Russia’s underperforming military capability may be key to its downfall,2022-09-18,1,0,0,0,0,1,0,1,1,,[3899.88989258],,,,ללא שינוי,ללא שינוי
 ‘It’s a huge honour’: military rehearses for Queen’s funeral procession,2022-09-13,0,0,0,1,1,1,0,1,0,[3932.68994141],[3946.01000977],[3855.92993164],[13.32006836],[-76.76000977],עלייה,ירידה
The Guardian view on Putin’s military escalation: a failing strategy | Editorial,2022-09-21,1,0,1,0,0,1,0,1,1,[3789.92993164],[3757.98999023],[3719.04003906],[-31.93994141],[-70.88989258],ירידה,ירידה
Putin’s nuclear threat shows a desperate man out of options | Simon Jenkins,2022-09-23,1,0,1,0,0,1,0,1,1,[3693.22998047],,[3585.62011719],,[-107.60986328],ללא שינוי,ירידה
"The nuclear threat might change the mood in Russia itself, stoking widespread fear | Peter Pomerantsev",2022-09-25,1,0,1,0,0,1,0,1,1,,[3655.04003906],,,,ללא שינוי,ללא שינוי
Richard Marles condemns Russia’s ‘appalling’ nuclear threat and pledges long-term Ukraine support,2022-09-25,1,0,1,0,0,0,0,1,1,,[3655.04003906],,,,ללא שינוי,ללא שינוי
"Morning mail: leaders condemn Putin’s nuclear threat, basin plan in peril, mass whale stranding",2022-09-21,1,0,1,0,0,0,0,1,1,[3789.92993164],[3757.98999023],[3719.04003906],[-31.93994141],[-70.88989258],ירידה,ירידה
Biden denounces Putin’s nuclear threats as ‘reckless’ in UN address,2022-09-21,1,0,1,0,0,0,0,1,1,[3789.92993164],[3757.98999023],[3719.04003906],[-31.93994141],[-70.88989258],ירידה,ירידה
"UK visa delays ‘causing rent, employment and healthcare issues’",2022-09-30,1,0,1,0,0,1,0,1,1,[3585.62011719],,[3639.65991211],,[54.03979492],ללא שינוי,עלייה
Food as medicine: could prescribing fruit and vegetables become part of healthcare?,2022-09-18,1,1,1,0,0,1,0,1,1,,[3899.88989258],,,,ללא שינוי,ללא שינוי
"There is no ‘magic wand’ for Australia’s healthcare system, but we desperately need a rethink | Ranjana Srivastava",2022-09-13,0,0,1,0,0,1,0,1,1,[3932.68994141],[3946.01000977],[3855.92993164],[13.32006836],[-76.76000977],עלייה,ירידה
Millions of UK patients forced to go private amid record NHS waiting lists,2022-09-11,1,0,1,0,0,1,0,1,1,,[4110.41015625],,,,ללא שינוי,ללא שינוי
"Videos on healthy eating can help obese children lose weight, study finds",2022-09-15,0,1,0,0,1,0,0,0,0,[3901.35009766],[3873.33007812],[3757.98999023],[-28.02001953],[-143.36010742],ירידה,ירידה
UK is only G7 country with smaller economy than before Covid-19,2022-09-30,1,0,0,0,0,1,0,1,1,[3585.62011719],,[3639.65991211],,[54.03979492],ללא שינוי,עלייה
She thought Covid-19 was the worst thing to happen to her schools. Then the fire came,2022-09-05,1,1,0,0,0,0,0,1,1,,[3908.18994141],[4110.41015625],,,ללא שינוי,ללא שינוי
Queen Elizabeth’s funeral will be held on Monday 19 September,2022-09-10,0,0,0,0,0,1,0,1,0,,,,,,ללא שינוי,ללא שינוי
Can you solve it? Maths of a hypothetical new Covid variant,2022-09-19,1,0,0,0,0,0,0,1,1,[3899.88989258],[3855.92993164],[3655.04003906],[-43.95996094],[-244.84985352],ירידה,ירידה
Royal Mail staff announce further 19 strikes over next two months,2022-09-27,0,0,1,0,0,1,0,1,1,[3647.29003906],[3719.04003906],[3790.92993164],[71.75],[143.63989258],עלייה,עלייה
Tell us your experiences of burnout following the pandemic,2022-09-21,0,0,0,0,0,1,0,1,1,[3789.92993164],[3757.98999023],[3719.04003906],[-31.93994141],[-70.88989258],ירידה,ירידה
"End of Covid pandemic ‘in sight’, says World Health Organization",2022-09-14,0,1,0,0,0,0,0,1,1,[3946.01000977],[3901.35009766],[3789.92993164],[-44.65991211],[-156.08007812],ירידה,ירידה
Clairo review – introspective pandemic-made pop bursts out into the open,2022-09-30,1,1,0,1,0,0,0,0,0,[3585.62011719],,[3639.65991211],,[54.03979492],ללא שינוי,עלייה
Biden’s claim that Covid pandemic is over sparks debate over future,2022-09-24,1,0,0,0,0,0,0,1,1,,,,,,ללא שינוי,ללא שינוי
UK’s small firms founded during pandemic face grim outlook as recession looms,2022-09-17,1,0,0,0,0,1,0,1,1,,,,,,ללא שינוי,ללא שינוי
UK approves second Covid vaccine targeting Omicron variant,2022-09-03,0,1,0,0,1,0,0,0,0,,,,,,ללא שינוי,ללא שינוי
"Monkeypox vaccine second doses available for most at risk, says UKHSA",2022-09-23,0,1,0,0,1,0,0,1,0,[3693.22998047],,[3585.62011719],,[-107.60986328],ללא שינוי,ירידה
"Covid vaccine could soon become annual shot, White House advisers say",2022-09-07,1,1,0,0,0,0,0,1,1,[3979.87011719],[4006.17993164],[3946.01000977],[26.30981445],[-33.86010742],עלייה,ירידה
New malaria vaccine comes a step closer as experts say it’s ‘the best yet’ ,2022-09-07,1,1,1,0,0,0,0,1,1,[3979.87011719],[4006.17993164],[3946.01000977],[26.30981445],[-33.86010742],עלייה,ירידה
Thousands of children at risk as vaccination rates fall in England,2022-09-29,1,0,0,0,0,1,0,1,1,[3640.4699707],[3585.62011719],[3744.52001953],[-54.84985352],[104.05004883],ירידה,עלייה
"Little evidence screaming helps mental health, say psychologists",2022-09-23,0,0,0,0,0,0,0,1,0,[3693.22998047],,[3585.62011719],,[-107.60986328],ללא שינוי,ירידה
The link between mental health and social conditions | Letters,2022-09-08,0,0,1,0,0,1,0,1,1,[4006.17993164],[4067.36010742],[3901.35009766],[61.18017578],[-104.82983398],עלייה,ירידה
"Botox patients should undergo mental health screening, experts say",2022-09-15,1,0,1,0,0,1,0,1,0,[3901.35009766],[3873.33007812],[3757.98999023],[-28.02001953],[-143.36010742],ירידה,ירידה
NHS mental health hospital staff filmed ‘mocking and slapping’ patients,2022-09-28,1,0,1,0,0,1,0,1,1,[3719.04003906],[3640.4699707],[3783.2800293],[-78.57006836],[64.23999023],ירידה,עלייה
‘Role overload’: the mental health burden of being a woman,2022-09-16,0,0,1,0,0,1,0,1,1,[3873.33007812],,[3693.22998047],,[-180.10009766],ללא שינוי,ירידה
UK economic growth remains tepid despite sizzling temperatures,2022-09-12,1,0,0,0,0,0,0,1,1,[4110.41015625],[3932.68994141],[3899.88989258],[-177.72021484],[-210.52026367],ירידה,ירידה
Labour’s low-carbon plans look like sensible economic policy,2022-09-27,1,1,0,0,0,0,1,1,1,[3647.29003906],[3719.04003906],[3790.92993164],[71.75],[143.63989258],עלייה,עלייה
Kwarteng tells City bosses his economic plan ‘will work’,2022-09-27,1,0,0,0,0,0,0,1,1,[3647.29003906],[3719.04003906],[3790.92993164],[71.75],[143.63989258],עלייה,עלייה
History suggests Kwarteng’s gargantuan economic gamble won’t end well,2022-09-23,1,0,0,0,0,0,0,1,1,[3693.22998047],,[3585.62011719],,[-107.60986328],ללא שינוי,ירידה
India is quietly laying claim to economic superpower status,2022-09-12,0,1,0,0,0,0,1,1,1,[4110.41015625],[3932.68994141],[3899.88989258],[-177.72021484],[-210.52026367],ירידה,ירידה
Porsche shares rise on first trading day in €75bn stock market float,2022-09-29,0,1,0,0,1,0,1,0,0,[3640.4699707],[3585.62011719],[3744.52001953],[-54.84985352],[104.05004883],ירידה,עלייה
Balakliia residents take stock after Ukraine recaptures frontline town,2022-09-13,1,0,0,0,0,0,0,1,1,[3932.68994141],[3946.01000977],[3855.92993164],[13.32006836],[-76.76000977],עלייה,ירידה
Porsche IPO could raise up to €75bn for parent Volkswagen,2022-09-19,0,1,0,0,0,0,1,1,0,[3899.88989258],[3855.92993164],[3655.04003906],[-43.95996094],[-244.84985352],ירידה,ירידה
UK mortgages: ‘next 10 days crucial’ in how much rates rise,2022-09-27,1,0,0,0,0,0,0,1,1,[3647.29003906],[3719.04003906],[3790.92993164],[71.75],[143.63989258],עלייה,עלייה
Church of England’s homophobic cruelty risks making it a laughing stock | Letters,2022-09-25,0,0,1,0,0,1,0,1,1,,[3655.04003906],,,,ללא שינוי,ללא שינוי
Morrisons profits plunge 50% after ‘unprecedented’ inflation,2022-09-28,1,0,0,0,0,1,0,1,1,[3719.04003906],[3640.4699707],[3783.2800293],[-78.57006836],[64.23999023],ירידה,עלייה
Federal Reserve warns of ‘pain’ ahead as inflation surges ,2022-09-21,1,0,0,0,0,0,0,1,1,[3789.92993164],[3757.98999023],[3719.04003906],[-31.93994141],[-70.88989258],ירידה,ירידה
Dow Jones plunges amid news of US inflation rates,2022-09-13,1,0,0,0,0,0,0,1,1,[3932.68994141],[3946.01000977],[3855.92993164],[13.32006836],[-76.76000977],עלייה,ירידה
UK inflation falls to 9.9% after drop in petrol prices,2022-09-14,1,0,0,0,0,0,0,1,1,[3946.01000977],[3901.35009766],[3789.92993164],[-44.65991211],[-156.08007812],ירידה,ירידה
Aldi becomes fourth largest supermarket as grocery inflation hits 12.4%,2022-09-13,1,0,0,0,0,0,0,1,1,[3932.68994141],[3946.01000977],[3855.92993164],[13.32006836],[-76.76000977],עלייה,ירידה
UK construction industry shrinks as recession looms ,2022-09-06,1,0,0,0,0,0,0,1,1,[3908.18994141],[3979.87011719],[3932.68994141],[71.68017578],[24.5],עלייה,עלייה
Recession fears shake Germany as energy costs hit business,2022-09-19,1,0,1,0,0,1,0,1,1,[3899.88989258],[3855.92993164],[3655.04003906],[-43.95996094],[-244.84985352],ירידה,ירידה
"Liz Truss’s energy price freeze could soften UK recession, say economists",2022-09-06,1,1,0,0,0,0,0,1,1,[3908.18994141],[3979.87011719],[3932.68994141],[71.68017578],[24.5],עלייה,עלייה
"Leading economies sliding into recession as Ukraine war cuts growth, OECD finds",2022-09-26,1,0,0,0,0,1,0,1,1,[3655.04003906],[3647.29003906],[3678.42993164],[-7.75],[23.38989258],ירידה,עלייה
Unprecedented events creating ‘extremely severe’ risk of global recession – economist Adam Tooze,2022-09-23,1,1,0,0,0,1,0,1,1,[3693.22998047],,[3585.62011719],,[-107.60986328],ללא שינוי,ירידה
Democrats call for justice department to investigate migrant flights,2022-09-23,1,0,1,0,0,0,0,1,0,[3693.22998047],,[3585.62011719],,[-107.60986328],ללא שינוי,ירידה
Dalian Atkinson’s family condemns justice system for six-year delay,2022-09-28,0,0,1,0,0,1,0,1,1,[3719.04003906],[3640.4699707],[3783.2800293],[-78.57006836],[64.23999023],ירידה,עלייה
Justice department appeals special master ruling for Trump documents,2022-09-09,0,0,1,0,0,0,0,1,1,[4067.36010742],,[3873.33007812],,[-194.0300293],ללא שינוי,ירידה
Thousands call for ‘climate reparations and justice’ in global protests,2022-09-23,1,0,1,0,0,1,0,1,1,[3693.22998047],,[3585.62011719],,[-107.60986328],ללא שינוי,ירידה
Liz Truss’s justice secretary urged to meet striking criminal barristers,2022-09-06,0,0,1,0,0,1,0,1,1,[3908.18994141],[3979.87011719],[3932.68994141],[71.68017578],[24.5],עלייה,עלייה
Labour must be the party of electoral reform | Letters,2022-09-29,0,1,1,0,0,0,0,1,0,[3640.4699707],[3585.62011719],[3744.52001953],[-54.84985352],[104.05004883],ירידה,עלייה
Why is Labour ignoring its own members on electoral reform? | Polly Toynbee,2022-09-30,1,0,1,0,0,1,0,1,1,[3585.62011719],,[3639.65991211],,[54.03979492],ללא שינוי,עלייה
New Met police chief snubs head of National Black Police Association,2022-09-25,0,0,1,0,0,1,0,1,1,,[3655.04003906],,,,ללא שינוי,ללא שינוי
"Without radical tax reform, Australia faces an insoluble public finance problem | Satyajit Das",2022-09-25,1,0,0,0,0,1,0,1,1,,[3655.04003906],,,,ללא שינוי,ללא שינוי
"Ukraine needs ‘radical’ reform to sustain war effort, warn economists",2022-09-09,1,0,0,0,0,1,0,1,1,[4067.36010742],,[3873.33007812],,[-194.0300293],ללא שינוי,ירידה
Climate change is GREAT for termites! Wait what is this? | First Dog on the Moon,2022-09-26,1,0,0,0,0,0,0,1,1,[3655.04003906],[3647.29003906],[3678.42993164],[-7.75],[23.38989258],ירידה,עלייה
Australian parliament passes first climate change legislation in a decade,2022-09-08,0,1,1,0,0,0,0,1,1,[4006.17993164],[4067.36010742],[3901.35009766],[61.18017578],[-104.82983398],עלייה,ירידה
