Members of vaccine taskforce to be reassigned to HRT crisis,2022-05-05,1,1,1,0,0,0,0,1,1,[4146.87011719],[4123.33984375],[3930.08007812],[-23.53027344],[-216.79003906],ירידה,ירידה
Piers Corbyn fined over ‘murder’ claim at Covid vaccine clinic,2022-05-06,0,0,1,0,0,0,0,1,0,[4123.33984375],,[4023.88989258],,[-99.44995117],ללא שינוי,ירידה
NSW considers making flu vaccine free as ambulance demand reaches unprecedented levels,2022-05-24,1,0,0,0,0,0,0,1,1,[3941.47998047],[3978.72998047],[4132.14990234],[37.25],[190.66992188],עלייה,עלייה
High-risk people eligible for second Covid booster vaccine under new Australian guidelines,2022-05-25,1,0,0,0,0,0,0,1,1,[3978.72998047],[4057.84008789],[4101.22998047],[79.11010742],[122.5],עלייה,עלייה
"Adventurous play boosts children’s mental health, study finds",2022-05-20,1,1,0,0,0,0,0,1,1,[3901.36010742],,[4158.24023438],,[256.88012695],ללא שינוי,עלייה
Reforms to mental health services are long overdue | Letter,2022-05-09,0,0,1,0,0,1,0,1,0,[3991.23999023],[4001.05004883],[4008.01000977],[9.81005859],[16.77001953],עלייה,עלייה
Schools need urgent funding to tackle child mental health crisis | Letters,2022-05-25,1,0,1,0,0,1,0,1,1,[3978.72998047],[4057.84008789],[4101.22998047],[79.11010742],[122.5],עלייה,עלייה
New Order singer criticises ‘ludicrous’ NHS mental health waiting lists,2022-05-18,1,0,1,0,0,1,0,1,0,[3923.67993164],[3900.79003906],[3978.72998047],[-22.88989258],[55.05004883],ירידה,עלייה
Studies on nature’s mental health benefits show ‘massive’ western bias,2022-05-06,0,0,0,0,0,0,0,1,0,[4123.33984375],,[4023.88989258],,[-99.44995117],ללא שינוי,ירידה
Sri Lanka’s PM resigns after weeks of protests over economic crisis,2022-05-09,1,0,1,0,0,1,0,1,1,[3991.23999023],[4001.05004883],[4008.01000977],[9.81005859],[16.77001953],עלייה,עלייה
Lebanon votes in first national election since onset of economic crisis,2022-05-15,1,0,1,0,0,1,0,1,1,,[4008.01000977],,,,ללא שינוי,ללא שינוי
‘People are going to die’: crisis-hit Sri Lanka runs out of medicine,2022-05-31,1,0,1,0,0,1,0,1,1,[4132.14990234],[4101.22998047],[4160.68017578],[-30.91992188],[28.53027344],ירידה,עלייה
Crisis? What crisis? It’s hard to keep up | Brief letters,2022-05-02,0,0,1,0,0,1,0,1,1,[4155.37988281],[4175.47998047],[3991.23999023],[20.10009766],[-164.13989258],עלייה,ירידה
The Observer view on the cost of living crisis | Observer editorial,2022-05-01,1,0,1,0,0,1,0,1,1,,[4155.37988281],,,,ללא שינוי,ללא שינוי
US stock markets fall sharply as investors worry about recession,2022-05-19,1,0,0,0,0,0,0,1,1,[3900.79003906],[3901.36010742],[4057.84008789],[0.57006836],[157.05004883],עלייה,עלייה
Global stock markets fall sharply amid fears over inflation and China slowdown,2022-05-09,1,0,0,0,0,0,0,1,1,[3991.23999023],[4001.05004883],[4008.01000977],[9.81005859],[16.77001953],עלייה,עלייה
Why Britain’s housing market is crumbling | Letters,2022-05-17,0,0,1,0,0,1,0,1,1,[4088.85009766],[3923.67993164],[3941.47998047],[-165.17016602],[-147.37011719],ירידה,ירידה
Time for A-Leagues to take stock after calamitous and underwhelming season | Joey Lynch,2022-05-30,0,1,0,0,0,1,0,1,0,,[4132.14990234],[4121.43017578],,,ללא שינוי,ללא שינוי
UK pharmacists to offer alternatives to out of stock HRT products,2022-05-20,1,1,1,0,0,0,0,1,0,[3901.36010742],,[4158.24023438],,[256.88012695],ללא שינוי,עלייה
Soaring inflation is a symptom of ‘free market’ orthodoxy | Letter,2022-05-27,0,0,1,0,0,1,0,1,1,[4158.24023438],,[4108.54003906],,[-49.70019531],ללא שינוי,ירידה
Retail sales in Great Britain jump despite soaring inflation,2022-05-20,0,1,0,0,0,0,0,1,1,[3901.36010742],,[4158.24023438],,[256.88012695],ללא שינוי,עלייה
Recession: the price Britain will pay to control inflation,2022-05-05,1,0,0,0,0,1,0,1,1,[4146.87011719],[4123.33984375],[3930.08007812],[-23.53027344],[-216.79003906],ירידה,ירידה
Wagamama owner warns food and drink inflation could hit 10%,2022-05-24,1,0,1,0,0,0,0,1,1,[3941.47998047],[3978.72998047],[4132.14990234],[37.25],[190.66992188],עלייה,עלייה
B&Q owner Kingfisher ‘managing inflation’ as DIY demand continues,2022-05-23,0,1,0,0,0,0,1,1,0,[3973.75],[3941.47998047],,[-32.27001953],,ירידה,ללא שינוי
Boris Johnson says UK ‘not necessarily’ heading for recession,2022-05-27,1,1,0,0,0,0,0,1,1,[4158.24023438],,[4108.54003906],,[-49.70019531],ללא שינוי,ירידה
Pressure grows for summer mini-budget amid recession fears ,2022-05-12,1,0,0,0,0,0,0,1,1,[3930.08007812],[4023.88989258],[3900.79003906],[93.80981445],[-29.29003906],עלייה,ירידה
Recession: the price Britain will pay to control inflation,2022-05-05,1,0,0,0,0,1,0,1,1,[4146.87011719],[4123.33984375],[3930.08007812],[-23.53027344],[-216.79003906],ירידה,ירידה
US stock markets fall sharply as investors worry about recession,2022-05-19,1,0,0,0,0,0,0,1,1,[3900.79003906],[3901.36010742],[4057.84008789],[0.57006836],[157.05004883],עלייה,עלייה
"Stocks, oil and bitcoin hit by recession worries – as it happened",2022-05-09,1,0,0,0,0,1,0,1,1,[3991.23999023],[4001.05004883],[4008.01000977],[9.81005859],[16.77001953],עלייה,עלייה
Four in five people in the UK believe in being ‘woke’ to race and social justice,2022-05-01,0,1,0,0,1,0,0,0,0,,[4155.37988281],,,,ללא שינוי,ללא שינוי
Lincoln Crowley appointed Australia’s first Indigenous supreme court justice,2022-05-27,0,1,1,1,0,0,0,0,0,[4158.24023438],,[4108.54003906],,[-49.70019531],ללא שינוי,ירידה
The Guardian view on the Covid inquiry: looking for justice | Editorial,2022-05-08,1,0,1,0,0,0,0,1,1,,[3991.23999023],,,,ללא שינוי,ללא שינוי
‘Always a possibility of change’: incarcerated teens seek justice as adults,2022-05-26,1,1,1,0,0,1,0,1,1,[4057.84008789],[4158.24023438],[4176.81982422],[100.40014648],[118.97973633],עלייה,עלייה
‘Ella’s law’ bill seeks to establish right to clean air in UK,2022-05-20,1,1,1,0,0,0,0,0,1,[3901.36010742],,[4158.24023438],,[256.88012695],ללא שינוי,עלייה
Biden signs police reform executive order on anniversary of George Floyd’s murder,2022-05-25,1,1,1,1,1,1,0,1,1,[3978.72998047],[4057.84008789],[4101.22998047],[79.11010742],[122.5],עלייה,עלייה
Visa rules for trainee GPs need urgent reform | Letter,2022-05-19,0,0,1,0,0,1,0,1,1,[3900.79003906],[3901.36010742],[4057.84008789],[0.57006836],[157.05004883],עלייה,עלייה
Tony Burke vows to ‘fix’ parliament as crossbench demands reform,2022-05-24,0,1,1,0,0,0,0,1,0,[3941.47998047],[3978.72998047],[4132.14990234],[37.25],[190.66992188],עלייה,עלייה
From lock-up to sobering up: Victoria grapples with public drunkenness reform,2022-05-14,1,0,1,0,0,0,0,1,1,,,,,,ללא שינוי,ללא שינוי
‘Poverty-level wages’: California workers fight to reform nursing homes ,2022-05-04,0,0,1,0,0,1,0,1,1,[4300.16992188],[4146.87011719],[3935.17993164],[-153.29980469],[-364.98999023],ירידה,ירידה
UK finance ‘faces £340bn in losses’ without action on climate change,2022-05-24,1,0,0,0,0,1,0,1,1,[3941.47998047],[3978.72998047],[4132.14990234],[37.25],[190.66992188],עלייה,עלייה
Vanuatu’s push for legal protection from climate change wins crucial support,2022-05-10,1,1,0,0,0,0,0,1,1,[4001.05004883],[3935.17993164],[4088.85009766],[-65.87011719],[87.80004883],ירידה,עלייה
Biden praises Ardern for ‘galvanising action’ on gun control and climate change,2022-05-31,1,1,1,0,0,1,0,1,1,[4132.14990234],[4101.22998047],[4160.68017578],[-30.91992188],[28.53027344],ירידה,עלייה
Australia’s rightwing government weaponised climate change – now it has faced its reckoning,2022-05-22,0,1,1,0,0,0,0,1,1,,[3973.75],,,,ללא שינוי,ללא שינוי
Pitting bands against each other won’t help the music industry fight climate change | Letter,2022-05-20,0,1,1,0,0,0,0,1,0,[3901.36010742],,[4158.24023438],,[256.88012695],ללא שינוי,עלייה
Qatar World Cup criticised for ‘problematic’ carbon footprint promises,2022-05-30,0,0,1,0,0,0,0,1,1,,[4132.14990234],[4121.43017578],,,ללא שינוי,ללא שינוי
Greenhouse gas removal ‘not a silver bullet to achieve net zero’,2022-05-30,1,0,0,0,0,0,0,1,1,,[4132.14990234],[4121.43017578],,,ללא שינוי,ללא שינוי
Johnson’s ‘jet zero’ plan unrealistic and may make UK miss CO2 targets – report,2022-05-16,0,0,1,0,0,0,0,1,1,[4008.01000977],[4088.85009766],[3973.75],[80.84008789],[-34.26000977],עלייה,ירידה
Carbon bombs: Inside the 20 May Guardian Weekly,2022-05-18,1,0,1,0,0,0,0,1,1,[3923.67993164],[3900.79003906],[3978.72998047],[-22.88989258],[55.05004883],ירידה,עלייה
MEPs call for 20% reduction in car emissions by 2025,2022-05-11,0,0,0,0,0,0,1,1,1,[3935.17993164],[3930.08007812],[3923.67993164],[-5.09985352],[-11.5],ירידה,ירידה
UK cybersecurity unit tackles record number of online scams in 2021,2022-05-10,1,1,0,0,0,0,0,1,0,[4001.05004883],[3935.17993164],[4088.85009766],[-65.87011719],[87.80004883],ירידה,עלייה
Use of Pegasus spyware on Spain’s politicians causing ‘crisis of democracy’,2022-05-15,1,0,1,0,0,1,0,1,1,,[4008.01000977],,,,ללא שינוי,ללא שינוי
Clinton lawyer acquitted of lying to FBI when he briefed them on Trump-Russia links – as it happened,2022-05-31,1,1,1,0,0,1,0,1,1,[4132.14990234],[4101.22998047],[4160.68017578],[-30.91992188],[28.53027344],ירידה,עלייה
"Russian hackers targeting opponents of Ukraine invasion, warns GCHQ chief",2022-05-10,1,0,0,0,0,0,0,1,1,[4001.05004883],[3935.17993164],[4088.85009766],[-65.87011719],[87.80004883],ירידה,עלייה
Security warnings at UK nuclear facilities hit 12-year high as inspections fall,2022-05-26,1,0,0,0,0,0,0,1,1,[4057.84008789],[4158.24023438],[4176.81982422],[100.40014648],[118.97973633],עלייה,עלייה
Biden pitches Democrats as saviors for US economy ahead of midterm elections,2022-05-23,1,0,1,0,0,0,0,1,1,[3973.75],[3941.47998047],,[-32.27001953],,ירידה,ללא שינוי
Chief BoE economist: we’ll squeeze economy more to tame inflation ,2022-05-20,1,0,0,0,0,0,0,1,1,[3901.36010742],,[4158.24023438],,[256.88012695],ללא שינוי,עלייה
This age of inflation reveals the sickness ailing Britain’s economy: rentier capitalism | William Davies,2022-05-30,0,0,1,0,0,1,0,1,1,,[4132.14990234],[4121.43017578],,,ללא שינוי,ללא שינוי
Tony Blair tells Starmer to drop ‘woke’ politics and focus on economy,2022-05-13,1,0,0,0,0,0,1,1,1,[4023.88989258],,[3901.36010742],,[-122.52978516],ללא שינוי,ירידה
‘Nature doesn’t fix itself fast’: Greenland weighs up economy v climate crisis,2022-05-07,1,1,0,0,0,0,0,1,1,,,,,,ללא שינוי,ללא שינוי
Maduro glimpses political lifeline as US rethinks Venezuela policy,2022-05-19,0,1,1,0,0,1,0,1,1,[3900.79003906],[3901.36010742],[4057.84008789],[0.57006836],[157.05004883],עלייה,עלייה
Beijing accuses US of ‘political manipulation’ in latest Taiwan row,2022-05-10,1,0,1,0,0,0,0,1,1,[4001.05004883],[3935.17993164],[4088.85009766],[-65.87011719],[87.80004883],ירידה,עלייה
Australia election: 10 lessons UK politics can learn,2022-05-24,0,1,1,1,0,0,0,1,1,[3941.47998047],[3978.72998047],[4132.14990234],[37.25],[190.66992188],עלייה,עלייה
Philippines election result is a win for dynasty politics,2022-05-26,1,0,1,0,0,0,0,1,1,[4057.84008789],[4158.24023438],[4176.81982422],[100.40014648],[118.97973633],עלייה,עלייה
Vladimir by Julia May Jonas review – slippery sexual politics,2022-05-23,0,0,0,0,0,1,0,1,0,[3973.75],[3941.47998047],,[-32.27001953],,ירידה,ללא שינוי
"Leonid Kravchuk, first president of Ukraine, dies aged 88",2022-05-10,0,0,0,0,0,1,0,1,1,[4001.05004883],[3935.17993164],[4088.85009766],[-65.87011719],[87.80004883],ירידה,עלייה
New era for Philippines as Ferdinand Marcos Jr proclaimed president,2022-05-25,1,0,1,0,0,0,0,1,1,[3978.72998047],[4057.84008789],[4101.22998047],[79.11010742],[122.5],עלייה,עלייה
"Sushi, Pacific lobster … cheeseburgers: Japanese food fit for a president",2022-05-23,0,0,0,0,0,0,0,1,0,[3973.75],[3941.47998047],,[-32.27001953],,ירידה,ללא שינוי
Biden and South Korean president mull expanding joint military exercises,2022-05-21,1,0,0,0,0,0,0,1,1,,,,,,ללא שינוי,ללא שינוי
Rwanda president suggests UK extradite genocide suspects after asylum deal,2022-05-16,0,0,1,0,0,0,0,1,1,[4008.01000977],[4088.85009766],[3973.75],[80.84008789],[-34.26000977],עלייה,ירידה
Republicans seek to install ‘permanent election integrity infrastructure’ across US,2022-06-30,1,0,1,0,0,0,0,1,1,[3785.37988281],[3825.33007812],[3902.62011719],[39.95019531],[117.24023438],עלייה,עלייה
The ‘big lie’ advocates threatening free and fair elections across the US,2022-06-15,1,0,1,0,0,0,0,1,1,[3789.98999023],[3666.77001953],[3759.88989258],[-123.2199707],[-30.10009766],ירידה,ירידה
Election guru Lynton Crosby attending PM’s morning meetings,2022-06-17,0,0,1,0,0,0,0,1,1,[3674.84008789],,[3911.73999023],,[236.89990234],ללא שינוי,עלייה
US supreme court case could give state politicians huge power over elections,2022-06-30,1,0,1,0,0,0,0,1,1,[3785.37988281],[3825.33007812],[3902.62011719],[39.95019531],[117.24023438],עלייה,עלייה
‘Farmgate’ threatens Cyril Ramaphosa’s South Africa re-election bid,2022-06-17,1,0,1,0,0,0,0,1,1,[3674.84008789],,[3911.73999023],,[236.89990234],ללא שינוי,עלייה
Republicans who aided coup attempt sought blanket presidential pardons,2022-06-24,1,0,1,0,0,0,0,1,1,[3911.73999023],,[3825.33007812],,[-86.40991211],ללא שינוי,ירידה
Blind Kenyan singer goes to court over rejected presidential candidacy,2022-06-16,0,0,1,0,0,1,0,1,0,[3666.77001953],[3674.84008789],[3795.72998047],[8.07006836],[128.95996094],עלייה,עלייה
Trump lawyer John Eastman sought presidential pardon after January 6,2022-06-16,1,0,1,0,0,0,0,1,1,[3666.77001953],[3674.84008789],[3795.72998047],[8.07006836],[128.95996094],עלייה,עלייה
Capitol attack pardon revelations could spell doom for Trump and allies,2022-06-12,1,0,1,0,0,0,0,1,1,,[3749.62988281],,,,ללא שינוי,ללא שינוי
"Biden Saudi visit is ‘presidential pardon for murder’, says ex-spy chief’s son",2022-06-16,1,0,1,0,0,1,0,1,1,[3666.77001953],[3674.84008789],[3795.72998047],[8.07006836],[128.95996094],עלייה,עלייה
Republican party building an ‘army’ to overturn election results – report,2022-06-01,1,0,1,0,0,0,0,1,1,[4101.22998047],[4176.81982422],[4115.77001953],[75.58984375],[14.54003906],עלייה,עלייה
"After the election results in California, the left must organize and fight | Ben Davis",2022-06-10,1,0,1,0,0,1,0,1,1,[3900.86010742],,[3674.84008789],,[-226.02001953],ללא שינוי,ירידה
‘They wanted one of their own’: western Sydney election results show power of hyper-local politics,2022-06-02,0,0,1,0,0,1,1,1,0,[4176.81982422],[4108.54003906],[4017.82006836],[-68.27978516],[-158.99975586],ירידה,ירידה
Beware delays in monkeypox test results | Letters,2022-06-22,1,0,1,0,0,1,0,1,0,[3759.88989258],[3795.72998047],[3818.83007812],[35.84008789],[58.94018555],עלייה,עלייה
Is Australia’s election result a teal revolution or an old story of centre-right flight? | Van Badham,2022-06-01,0,0,0,0,0,0,0,1,1,[4101.22998047],[4176.81982422],[4115.77001953],[75.58984375],[14.54003906],עלייה,עלייה
Boris Johnson faces double verdict as polls open in byelections,2022-06-23,1,0,0,0,0,0,0,1,1,[3795.72998047],[3911.73999023],[3785.37988281],[116.01000977],[-10.35009766],עלייה,ירידה
Boris Johnson’s future in the frame as polls close in byelections,2022-06-24,1,0,0,0,0,0,0,1,1,[3911.73999023],,[3825.33007812],,[-86.40991211],ללא שינוי,ירידה
‘Startling’: Queensland independent polls second in Groom with only 8.3% of primary vote,2022-06-15,0,1,0,0,0,0,0,1,0,[3789.98999023],[3666.77001953],[3759.88989258],[-123.2199707],[-30.10009766],ירידה,ירידה
"Nearly half of Republicans think US has to live with mass shootings, poll finds",2022-06-06,1,1,1,0,0,1,0,1,1,[4121.43017578],[4160.68017578],[3749.62988281],[39.25],[-371.80029297],עלייה,ירידה
"As France goes to the polls, voters are asking: who really is Emmanuel Macron? | Marion Van Renterghem",2022-06-12,1,0,0,0,0,0,0,1,1,,[3749.62988281],,,,ללא שינוי,ללא שינוי
Ukrainian spouses in Gaza suffer from double conflict,2022-06-27,1,0,0,0,0,1,0,1,1,[3900.11010742],[3821.55004883],,[-78.56005859],,ירידה,ללא שינוי
The big idea: is a world without violent conflict really possible?,2022-06-06,1,1,0,0,0,1,0,1,1,[4121.43017578],[4160.68017578],[3749.62988281],[39.25],[-371.80029297],עלייה,ירידה
"US to increase military forces across Europe, Joe Biden announces",2022-06-29,1,0,1,0,0,0,0,1,1,[3818.83007812],[3785.37988281],[3845.08007812],[-33.45019531],[26.25],ירידה,עלייה
100 days of war in Ukraine: how the conflict has developed,2022-06-01,1,0,1,0,0,0,0,1,1,[4101.22998047],[4176.81982422],[4115.77001953],[75.58984375],[14.54003906],עלייה,עלייה
"Germany must ‘normalise’ relationship with military, says SPD co-leader",2022-06-21,1,0,0,0,0,0,0,1,1,[3764.79003906],[3759.88989258],[3821.55004883],[-4.90014648],[56.76000977],ירידה,עלייה
Colbert on Trump’s ‘election defense fund’: ‘The whole thing was a grift’,2022-06-15,0,0,1,0,0,0,0,1,0,[3789.98999023],[3666.77001953],[3759.88989258],[-123.2199707],[-30.10009766],ירידה,ירידה
The ‘big rip-off’: how Trump exploited his fans with ‘election defense’ fund ,2022-06-18,1,0,1,0,0,1,0,1,0,,,,,,ללא שינוי,ללא שינוי
Ukraine’s forces remain on the defensive in the eastern Donbas region – as it happened ,2022-06-20,1,1,1,1,0,0,0,1,1,,[3764.79003906],[3900.11010742],,,ללא שינוי,ללא שינוי
Boris Johnson faces tax questions after signalling defence budget rise,2022-06-30,1,0,1,0,0,0,0,1,1,[3785.37988281],[3825.33007812],[3902.62011719],[39.95019531],[117.24023438],עלייה,עלייה
NSW state budget 2022: lessons learned from Coalition election losses,2022-06-21,0,1,0,0,0,0,1,1,1,[3764.79003906],[3759.88989258],[3821.55004883],[-4.90014648],[56.76000977],ירידה,עלייה
"US to increase military forces across Europe, Joe Biden announces",2022-06-29,1,0,1,0,0,0,0,1,1,[3818.83007812],[3785.37988281],[3845.08007812],[-33.45019531],[26.25],ירידה,עלייה
"Germany must ‘normalise’ relationship with military, says SPD co-leader",2022-06-21,1,0,0,0,0,0,0,1,1,[3764.79003906],[3759.88989258],[3821.55004883],[-4.90014648],[56.76000977],ירידה,עלייה
The sailor who turned the tide on HIV in the military,2022-06-12,1,0,1,1,0,1,0,1,1,,[3749.62988281],,,,ללא שינוי,ללא שינוי
At least 12 military bases contaminating water supply with toxic PFAS,2022-06-06,1,0,1,0,0,0,0,1,1,[4121.43017578],[4160.68017578],[3749.62988281],[39.25],[-371.80029297],עלייה,ירידה
Shadowy Strava users spy on Israeli military with fake routes in bases,2022-06-21,1,0,1,0,0,0,0,1,1,[3764.79003906],[3759.88989258],[3821.55004883],[-4.90014648],[56.76000977],ירידה,עלייה
"Russia to send Belarus nuclear-capable missiles within months, as G7 leaders gather in Germany",2022-06-26,1,0,1,0,0,0,0,1,1,,[3900.11010742],,,,ללא שינוי,ללא שינוי
Iran and US ready to restart talks on nuclear deal,2022-06-25,1,1,0,0,0,0,0,1,1,,,,,,ללא שינוי,ללא שינוי
Iran accused of making ‘maximalist demands’ in nuclear deal talks,2022-06-30,1,0,1,0,0,1,0,1,1,[3785.37988281],[3825.33007812],[3902.62011719],[39.95019531],[117.24023438],עלייה,עלייה
Global nuclear arsenal expected to grow for first time in decades,2022-06-13,1,0,1,0,0,1,0,1,1,[3749.62988281],[3735.47998047],,[-14.14990234],,ירידה,ללא שינוי
Falling NHS continuity of care poses ‘existential threat’ to patient safety,2022-06-29,1,0,1,0,0,1,0,1,1,[3818.83007812],[3785.37988281],[3845.08007812],[-33.45019531],[26.25],ירידה,עלייה
"US could have saved 338,000 lives from Covid with universal healthcare, study finds",2022-06-16,1,0,1,0,0,1,0,1,1,[3666.77001953],[3674.84008789],[3795.72998047],[8.07006836],[128.95996094],עלייה,עלייה
More healthcare to go online in England under digitisation plan,2022-06-29,0,1,0,0,0,0,0,1,1,[3818.83007812],[3785.37988281],[3845.08007812],[-33.45019531],[26.25],ירידה,עלייה
Australia’s doctor deserts: see how your suburb compares in access to healthcare,2022-06-26,1,0,1,0,0,1,0,1,1,,[3900.11010742],,,,ללא שינוי,ללא שינוי
‘Blood on their hands’: world’s medics condemn US overturn of abortion rights,2022-06-24,1,0,1,0,0,1,0,1,1,[3911.73999023],,[3825.33007812],,[-86.40991211],ללא שינוי,ירידה
"Daniel Andrews tells private healthcare groups wanting $3,000 staff bonuses to pay their own rewards",2022-06-13,0,0,1,0,0,0,0,1,0,[3749.62988281],[3735.47998047],,[-14.14990234],,ירידה,ללא שינוי
Delayed public inquiry into UK’s Covid-19 response opens,2022-06-28,0,0,1,1,0,0,0,1,1,[3821.55004883],[3818.83007812],[3831.38989258],[-2.7199707],[9.83984375],ירידה,עלייה
US Covid-19 vaccine rollout for under-fives must overcome hesitancy,2022-06-26,1,1,0,0,0,0,0,1,1,,[3900.11010742],,,,ללא שינוי,ללא שינוי
Wimbledon reviews Covid-19 protocols after Berrettini is forced out by virus,2022-06-28,1,0,0,0,0,1,0,1,0,[3821.55004883],[3818.83007812],[3831.38989258],[-2.7199707],[9.83984375],ירידה,עלייה
‘Chaos’: Australian doctors call for renewed focus on Covid-19 as winter sets in,2022-06-09,1,0,1,0,0,1,0,1,1,[4017.82006836],[3900.86010742],[3666.77001953],[-116.95996094],[-351.05004883],ירידה,ירידה
"Dogs may be better at detecting Covid-19 than nasal PCR tests, study finds",2022-06-02,0,1,0,0,1,0,0,1,0,[4176.81982422],[4108.54003906],[4017.82006836],[-68.27978516],[-158.99975586],ירידה,ירידה
Pound falls to lowest level since pandemic crash,2022-06-14,1,0,0,0,0,0,0,1,1,[3735.47998047],[3789.98999023],[3764.79003906],[54.51000977],[29.31005859],עלייה,עלייה
Is the Covid pandemic finally nearing its end? | Aris Katzourakis,2022-06-01,1,0,0,0,0,0,0,1,1,[4101.22998047],[4176.81982422],[4115.77001953],[75.58984375],[14.54003906],עלייה,עלייה
Wayfinder review – pandemic dream quest through Britain’s mythic landscape,2022-06-27,1,0,0,0,0,1,0,1,0,[3900.11010742],[3821.55004883],,[-78.56005859],,ירידה,ללא שינוי
Bilderberg reconvenes in person after two-year pandemic gap,2022-06-04,1,0,0,0,0,0,0,1,1,,,,,,ללא שינוי,ללא שינוי
Back to union-bashing: government is now openly aggressive | Larry Elliott,2022-06-23,0,0,1,0,0,0,0,1,1,[3795.72998047],[3911.73999023],[3785.37988281],[116.01000977],[-10.35009766],עלייה,ירידה
Moderna to build UK’s first mRNA vaccine research and manufacturing centre,2022-06-22,0,1,0,0,1,0,1,0,1,[3759.88989258],[3795.72998047],[3818.83007812],[35.84008789],[58.94018555],עלייה,עלייה
US Covid-19 vaccine rollout for under-fives must overcome hesitancy,2022-06-26,1,1,0,0,0,0,0,1,1,,[3900.11010742],,,,ללא שינוי,ללא שינוי
‘You get goosebumps from the data’: hopes rise for new malaria vaccine,2022-06-27,1,1,1,1,0,0,0,1,1,[3900.11010742],[3821.55004883],,[-78.56005859],,ירידה,ללא שינוי
Ted Cruz bashes new Sesame Street video discussing Covid vaccine for children,2022-06-29,0,0,1,0,0,0,0,1,0,[3818.83007812],[3785.37988281],[3845.08007812],[-33.45019531],[26.25],ירידה,עלייה
Trials of new Covid vaccine raise hopes of once-a-year booster,2022-06-08,0,1,0,0,0,0,0,1,1,[4115.77001953],[4017.82006836],[3789.98999023],[-97.94995117],[-325.7800293],ירידה,ירידה
"In my school, as in others, there are not the funds to support children | Letter",2022-06-01,1,0,1,0,0,1,0,1,1,[4101.22998047],[4176.81982422],[4115.77001953],[75.58984375],[14.54003906],עלייה,עלייה
Warnings of mental health crisis among ‘Covid generation’ of students,2022-06-27,1,0,0,0,0,1,0,1,1,[3900.11010742],[3821.55004883],,[-78.56005859],,ירידה,ללא שינוי
Coroner issues warning on NHS mental health services after girl’s suicide,2022-06-29,1,0,1,0,0,1,0,1,1,[3818.83007812],[3785.37988281],[3845.08007812],[-33.45019531],[26.25],ירידה,עלייה
"UK is failing fostered children with mental health problems, warns charity",2022-06-26,0,0,1,0,0,1,0,1,1,,[3900.11010742],,,,ללא שינוי,ללא שינוי
 Victoria to conduct review into coercive practices in mental health system,2022-06-23,1,1,1,0,0,1,0,1,0,[3795.72998047],[3911.73999023],[3785.37988281],[116.01000977],[-10.35009766],עלייה,ירידה
Ukraine more than doubles interest rates as it fights economic crisis,2022-06-02,1,0,0,0,0,1,0,1,1,[4176.81982422],[4108.54003906],[4017.82006836],[-68.27978516],[-158.99975586],ירידה,ירידה
Young people in the UK: how has the pandemic and economic crisis affected you?,2022-06-01,1,0,0,0,0,0,0,1,1,[4101.22998047],[4176.81982422],[4115.77001953],[75.58984375],[14.54003906],עלייה,עלייה
We face a global economic crisis. And no one knows what to do about it,2022-06-18,1,0,0,0,0,1,0,1,1,,,,,,ללא שינוי,ללא שינוי
The Observer view on Britain’s dire economic outlook | Observer editorial,2022-06-12,1,0,1,0,0,1,0,1,1,,[3749.62988281],,,,ללא שינוי,ללא שינוי
